item_name,group,subcategory,url,path,description,scrape_status,location,loc_status
Blue Eye Orb,ITEMS,Multiplayer Items,https://darksouls.wiki.fextralife.com/Blue+Eye+Orb,/Blue+Eye+Orb,"Online play item. Invade world of player in Book of the Guilty. Subdue player to acquire Souvenir of Reprisal. (Only Covenanter can use the item) These mystical orbs are granted to Blades of the Darkmoon, knights who serve the Dark Sun Gwyndolin, so that they may serve the Gods in meting out vengeance.",ok_blockquote,[1] - Given to the player upon joining Blade of the Dark Moon covenant.,ok_loc_list
Book of the Guilty,ITEMS,Multiplayer Items,https://darksouls.wiki.fextralife.com/Book+of+the+Guilty,/Book+of+the+Guilty,"The goddess of Sin, Velka, oversees this list of the guilty, who have disrespected the Gods or their covenants, and shall one day face the wrath of the Blades of the Darkmoon.",ok_blockquote,[1] - This item can be bought from Oswald of Carim.,ok_loc_list
Cracked Red Eye Orb,ITEMS,Multiplayer Items,https://darksouls.wiki.fextralife.com/Cracked+Red+Eye+Orb,/Cracked+Red+Eye+Orb,Invade another world. (Hollows cannot use the item)Defeat the master of the world you have invaded to acquire humanity.The Cracked Red Eye Orb allows players to temporarily imitate this ability normally limited to the Darkwraiths of Kaathe.,ok_blockquote,"[1] - Sold by Darkstalker Kaathe for 3,000 souls. (see page for details). [2] - Treasure x4: In a chest below the elevator shaft in Firelink Shrine. [3] - Treasure x6: On a corpse hanging over a well in Lower New Londo Ruins.",ok_loc_list
Dragon Eye,ITEMS,Multiplayer Items,https://darksouls.wiki.fextralife.com/Dragon+Eye,/Dragon+Eye,"Online play item. Find a player who has acquired a Dragon Scale and invade that player's world to pillage it.An art of the transcendent apostles who pray to the ancient dragons. To be alive is to be vulnerable, and the fiery Gods are no exception. The apostles seek another plane of existence, which transcends life",ok_blockquote,[1] - Gift upon joining the Path of the Dragon covenant. [2] - Only Dragon Covenant members can use the item.,ok_loc_list
Dried Finger,ITEMS,Multiplayer Items,https://darksouls.wiki.fextralife.com/Dried+Finger,/Dried+Finger,"Dried finger with multiple knuckles.Shriveled but still warm. With this many knuckles, surely it cannot belong to anything human.",ok_blockquote,"[1] - Painted World of Ariamis. Drop down onto the balcony, from first left turret when facing the castle from the bonfire. [2] - In Dark Souls Remastered, the dried finger is now sold by the Undead Merchant in the Undead Burg, and the item from its previous location is a Twin Humanities. [3] - Note: Only one of this item can be held, leaving the player unable to pick it up in the next game cycle.",ok_loc_list
Eye Of Death,ITEMS,Multiplayer Items,https://darksouls.wiki.fextralife.com/Eye+of+Death,/Eye+of+Death,"Online play item. Lure phantoms from other worlds. (Only Covenanter can use this item while Hollows cannot)The dreadful Eyes of Death spread disaster across neighboring worlds. Phantoms lured to the host world may end up as victims, allowing the Eyes of Death to multiply, and leading to further proliferation of bane.",ok_blockquote,"[1] - 3 are obtainable in The Catacombs, behind a Titanite Demon. [2] - 3 are in the Tomb of Giants. Behind the 1st bonfire, it's up a path to the left of the ladder that goes to the Large Divine Ember. [3] - Patches the Hyena sells three of them for 3,000 Souls each. [4] - Drops from Basilisk (6% Chance - Depths, The Great Hollow and Ash Lake). [5] - Video Location Timestamp 1:52. [6] - Video Location Timestamp 2:07.",ok_loc_list
Indictment,ITEMS,Multiplayer Items,https://darksouls.wiki.fextralife.com/indictment,/indictment,"Slip sold by bishop of Velka, Goddess of Sin. If you are killed by an invader, use this to report the crime of that trespasser.The indicted player will be added to a list of unfortunate souls who will one day face the wrath of the Blades of the Darkmoon",ok_blockquote,"[1] - This item can be bought from Oswald of Carim. . He will appear at the base of the bell-tower, in Undead Parish, after the Gargoyles are defeated and the bell is rung.",ok_loc_list
Orange Guidance Soapstone,ITEMS,Multiplayer Items,https://darksouls.wiki.fextralife.com/Orange+Guidance+Soapstone,/Orange+Guidance+Soapstone,"Online play item. Write/view/rate message.Messages transmit to other worlds, where they are rated. Also, rate messages of others.In Lordran, the flow of time is distorted, and messages allow Undead to assist (or deceive) one another",ok_blockquote,[1] - Sold by the Undead Merchant for 100 Souls. [2] - Dropped by the Undead Merchant when killed.,ok_loc_list
Purple Coward's Crystal,ITEMS,Multiplayer Items,https://darksouls.wiki.fextralife.com/Purple+Coward's+Crystal,/Purple+Coward's+Crystal,"Online play item.Quit battle of Stoicism.(Session ends if host leaves)Victory in the battle once led to ancient Anor Londo, but even in the absence of its overseer, capitulation is a disgrace. In the name of a warrior's honor, do not quickly resort to use of this crystal.",ok_blockquote,"[1] - After defeating Artorias and exiting the arena, take the right path and go forward.",ok_loc_list
Red Eye Orb,ITEMS,Multiplayer Items,https://darksouls.wiki.fextralife.com/Red+Eye+Orb,/Red+Eye+Orb,Online play item. Invade another world. Defeat the master of the world you have invaded to acquire humanity.The Darkwraiths of Kaathe use this orb to seek humanity and plunge further into dark. Perhaps they are more human than we?,ok_blockquote,[1] - You receive this item after ranking up once with the Darkwraith covenant. [2] - Level one can be reached by offering 10 humanity to Darkstalker Kaathe. [3] - You may only use the Red Eye Orb as long as you are part of the Darkwraith covenant.,ok_loc_list
Red Sign Soapstone,ITEMS,Multiplayer Items,https://darksouls.wiki.fextralife.com/Red+Sign+Soapstone,/Red+Sign+Soapstone,"Be summoned to another world as a dark spirit, and defeat the summoner to acquire humanity.Certain Darkwraiths resist their descent into dark and preserve along the honorable path. The Red Soapstone is for them.",ok_blockquote,"[1] - This item is found in the Painted World of Ariamis, on top of the spiral stairs inside the round tower. [2] - Video Location Timestamp 9:08.",ok_loc_list
Servant Roster,ITEMS,Multiplayer Items,https://darksouls.wiki.fextralife.com/Servant+Roster,/Servant+Roster,"Online play item. Check servants of the Daughters of Chaos. Egg-bearer Eingyi keeps this roster of those who serve his master, a Daughter of Chaos. Eingyi praises those who offer significant humanity to alleviate his master's suffering. But what is praise from Eingyi really worth?",ok_blockquote,[1] - Sold by Eingyi.,ok_loc_list
Souvenir of Reprisal,ITEMS,Multiplayer Items,https://darksouls.wiki.fextralife.com/Souvenir+of+Reprisal,/Souvenir+of+Reprisal,"Blood-drained, shrunken ear. Souvenir taken from subduing the guilty.The knights called the Blades of the Darkmoon punish the guilty-soaked offenders of the Gods and take this as proof of their conquest. The earless corpses of the guilty will be left behind as a warning to others, inspiring both fear and respect for the Gods. Such is the eternal mandate of the Dark Sun",ok_blockquote,"[1] - While being a member of the Blade of the Dark Moon, invade and kill a player who have committed sins, either with the Blue Eye Orb or the Darkmoon Blade Covenant Ring. [2] - Killing Lautrec by invading his world, in Anor Londo, after he's killed Anastacia of Astora. [3] - Offer a Pendant to Snuggly the Crow and you will receive a Souvenir of Reprisal in exchange. [4] - Drops from Crow Demon (6% Chance - Painted World of Ariamis). [5] - Location Video Timestamp 28:32.",ok_loc_list
Sunlight Medal,ITEMS,Multiplayer Items,https://darksouls.wiki.fextralife.com/Sunlight+Medal,/Sunlight+Medal,"This faintly warm medal, engraved with the symbol of the Sun, is the ultimate honor, awarded to show those who summon the Warrior of Sunlight and complete a goal.The symbol represents Lord Gwyn's firstborn, who lost his deity status and was expunged from the annals. But the old God of War still watches closely over his warriors.",ok_blockquote,[1] - Location Video Timestamp 28:32.,ok_loc_list
White Sign Soapstone,ITEMS,Multiplayer Items,https://darksouls.wiki.fextralife.com/White+Sign+Soapstone,/White+Sign+Soapstone,"Online play item. Leave summon sign.Be summoned to another world as a phantom through your sign, and defeat the area boss to acquire humanity.In Lordran, the flow of time is distorted, and the White Sign Soapstone allows Undead to assist one another",ok_blockquote,"[1] - Gift from Solaire of Astora. [2] - Also available as a drop from Solaire if killed, but not recommended for he´ll become unavailable for further summoning.",ok_loc_list
Blue Titanite Chunk,ITEMS,Ore,https://darksouls.wiki.fextralife.com/Blue+Titanite+Chunk,/Blue+Titanite+Chunk,"Titanite chunk for weapon reinforcement. Blue titanite has powerful magic energy.Reinforces magic weapons to +9, and enchanted weapons to +4.With the discovery of chunks in Lordran, the race to locate the Legendary Slabs has begun. But could they be mere myth?",ok_blockquote,"[1] - Guaranteed drops from the last Black Knight in Kiln of the First Flame. [2] - Drops from Crystal Golems (8% Chance - Darkroot Basin, outside of The Duke's Archives and Crystal Cave). [3] - A Blue Titanite Chunk can be obtained by killing the Black Knight guarding the Grass Crest Shield at Darkroot Basin. [4] - Two Blue Titanite Chunk can be found in The Great Hollow. [5] - Dropped by the Blue Golem guarding the Broken Pendant in The Duke's Archives. (PTD). [6] - Dropped from Moonlight Butterfly (10% Chance ~ Crystal Cave). [7] - Drops from Vagrants, specifically the Red Good Vagrant. (Depths, Undead Burg, Undead Parish, Painted World of Ariamis, Darkroot Garden, Darkroot Basin, The Catacombs, Tomb of Giants, The Great Hollow, Ash Lake, Demon Ruins, Lost Izalith, Sen's Fortress, Blighttown, Anor Londo, New Londo Ruins Lower, New Londo Ruins Upper, The Duke's Archives, Crystal Cave, Northern Undead Asylum, Kiln of the First Flame and Royal Wood). [8] - Video Location Timestamp 30:38. [9] - Video Location Timestamp 32:53. [10] - Video Location Timestamp 6:50. [11] - Video Location Timestamp 5:06. [12] - Video Location Timestamp 13:16.",ok_loc_list
Blue Titanite Slab,ITEMS,Ore,https://darksouls.wiki.fextralife.com/Blue+Titanite+Slab,/Blue+Titanite+Slab,"Blue titanite slab for weapon reinforcement. Legendary Slabs were the domain of the Gods.Reinforces magic weapons to +10, and enchanted weapons to +5.Legendary Slabs are the heirlooms of a nameless blacksmith deity, who forged the weapons of other Gods. Weapons forged with this slab become rare legendary weapons.",ok_blockquote,"[1] - Rare drop from the Moonlight Butterflies in the Crystal Cave (0.2% chance). [2] - Crystal Cave: Take the long invisible path near a Crystal Lizard. Video Location Timestamp 9:45. [3] - Royal Woods (AotA only), in a chest hidden in a pool guarded by Stone Guardians. Same location of the Enchanted Ember. Video Location Timestamp 7:31.",ok_loc_list
Demon Titanite,ITEMS,Ore,https://darksouls.wiki.fextralife.com/Demon+Titanite,/Demon+Titanite,"Special titanite stolen from a faceless stone beast known as a Titanite Demon.When the nameless blacksmith deity passed, from several Slabs, great beasts arose.The power of titanite remains within them, and they still roam Lordran today.",ok_blockquote,"[1] - Obtained from Titanite Demons (2x from the respawning Demon in Lost Izalith and the non-respawning Demon in Anor Londo, but 1x from the rest). [2] - Trade with Snuggly: 1x for Dung Pie, 1x for Prism Stone. [3] - 1x dropped from the Titanite Demon near Andre in Undead Parish. [4] - 1x found in the first chest guarded by two Sentinels in Anor Londo. [5] - 1x found in the chest hidden down behind the first elevator tower in Anor Londo. [6] - 2x found in the chest inside the bedroom guarded by three Silver Knights in Anor Londo. [7] - Drops from Vagrants, specifically the Red Good Vagrant. (Depths, Undead Burg, Undead Parish, Painted World of Ariamis, Darkroot Garden, Darkroot Basin, The Catacombs, Tomb of Giants, The Great Hollow, Ash Lake, Demon Ruins, Lost Izalith, Sen's Fortress, Blighttown, Anor Londo, New Londo Ruins Lower, New Londo Ruins Upper, The Duke's Archives, Crystal Cave, Northern Undead Asylum, Kiln of the First Flame, and Royal Wood). [8] - Video Location Timestamp 1:45. [9] - Video Location Timestamp 11:30.",ok_loc_list
Dragon Scale,ITEMS,Ore,https://darksouls.wiki.fextralife.com/Dragon+Scale,/Dragon+Scale,"Dragon scale for reinforcing dragon weapons. Peeled from an ancient dragon.A dragon is inseparable from its scales, and the transcendent apostles, who seek the perpetuity of the ancient dragons, have crossed the very end of the earth to seek this invaluable treasure.",ok_blockquote,"[1] - Rare (5%) drop from Drakes in the Valley of Drakes. [2] - Trade with Snuggly: 1x for Egg Vermifuge. [3] - 1x from the Undead Dragon in the Valley of Drakes. [4] - 1x from the Undead Dragon in the Painted World of Ariamis. [5] - 1x from the Hydra in Darkroot Basin. [6] - 2x from the Black Hydra in Ash Lake. [7] - 1x in a chest close to the second bonfire in Blighttown. [8] - 1x on a corpse just to the left of the Black Hydra in Ash Lake. [9] - 1x on a floating corpse past the Man-Eater Shells in Ash Lake. [10] - 1x inside the hollow tree on the beach in Ash Lake. [11] - Can also be obtained as a reward for invading while part of the Path of the Dragon covenant. [12] - Drops from Vagrants, specifically the Red Good Vagrant. (Depths, Undead Burg, Undead Parish, Painted World of Ariamis, Darkroot Garden, Darkroot Basin, The Catacombs, Tomb of Giants, The Great Hollow, Ash Lake, Demon Ruins, Lost Izalith, Sen's Fortress, Blighttown, Anor Londo, New Londo Ruins Lower, New Londo Ruins Upper, The Duke's Archives, Crystal Cave, Northern Undead Asylum, Kiln of the First Flame, and Royal Wood). [13] - Video Location Timestamp 16:07. [14] - Video Location Timestamp 1:16. [15] - Video Location Timestamp 1:20. [16] - Video Location Timestamp 2:12. [17] - Video Location Timestamp 3:23. [18] - Video Location Timestamp 6:56.",ok_loc_list
Green Titanite Shard,ITEMS,Ore,https://darksouls.wiki.fextralife.com/Green+Titanite+Shard,/Green+Titanite+Shard,"Titanite shard for weapon reinforcement.Green titanite imbued with a special power.Reinforces magic, divine, fire weapons to +5. ""Titanite shards are fragments of the Legendary Slabs.Titanite is etched into weapons to reinforce.""",ok_blockquote,[1] - Video Location Timestamp 20:49. [2] - Video Location Timestamp 4:12. [3] - Video Location Timestamp 6:27. [4] - Video Location Timestamp 19:36. [5] - Video Location Timestamp 14:52. [6] - Video Location Timestamp 16:17.,ok_loc_list
Large Titanite Shard,ITEMS,Ore,https://darksouls.wiki.fextralife.com/Large+Titanite+Shard,/Large+Titanite+Shard,"Titanite shard for weapon reinforcement. Larger titanite material.Reinforces standard weapons to +10, and raw weapons to +5. Titanite shards are fragments of the Legendary Slabs. Titanite is etched into weapons to reinforce.",ok_blockquote,[1] - Video Blighttown Treasure Location 1 Timestamp 17:49. [2] - Video Blighttown Trasure Location Location 2 Timestamp 19:37.,ok_loc_list
Red Titanite Chunk,ITEMS,Ore,https://darksouls.wiki.fextralife.com/Red+Titanite+Chunk,/Red+Titanite+Chunk,"Titanite chunk for weapon reinforcement. Red titanite has powerful fire energy.Reinforces fire weapons to +9, and chaos weapons to +4.With the discovery of chunks in Lordran, the race to locate the Legendary Slabs has begun. But could they be mere myth",ok_blockquote,"[1] - Demon Ruins: Drops from Burrowing Rockworm (5% Chance), not farmable.",ok_loc_list
Red Titanite Slab,ITEMS,Ore,https://darksouls.wiki.fextralife.com/Red+Titanite+Slab,/Red+Titanite+Slab,"Red titanite slab for weapon reinforcement. Legendary Slabs were the domain of the Gods. Reinforces fire weapons to +10, and chaos weapons to +5. Legendary Slabs are the heirlooms of a nameless blacksmith deity, who forged the weapons of other Gods. Weapons forged with this slab become rare legendary weapons.",ok_blockquote,[1] - Lost Izalith: In a chest of the sewer area near Bed of Chaos. Video Location Timestamp 20:38. [2] - Rare drop from Chaos Eaters in Lost Izalith (0.3% Chance). [3] - Trade the Ascended version of a +0 Pyromancy Flame with Snuggly (higher than +0 are not accepted). [4] - See the Titanite Farming page for more details.,ok_loc_list
Titanite Chunk,ITEMS,Ore,https://darksouls.wiki.fextralife.com/Titanite+Chunk,/Titanite+Chunk,"Titanite chunk for weapon reinforcement. Not found outside of Lordran.Reinforces standard weapons to +14, and crystal, lightning weapons to +4.With the discovery of chunks in Lordran, the race to locate the Legendary Slabs has begun. But could they be mere myth",ok_blockquote,"[1] - DarkWraith Knights in New Londo Ruins, after depleting the water level and opening the doors connecting Valley of Drakes. Rare drop. [2] - Drops from Crystal Lizard (8.33% or 41.67% - Undead Burg, The Catacombs, Tomb of Giants, The Great Hollow, Darkroot Garden, Lost Izalith, Crystal Cave, The Duke's Archives, Royal Wood, Oolacile Township and Chasm of the Abyss). [3] - Drops from The Black Knight. (Guaranteed - Undead Burg, Undead Parish and Kiln of the First Flame). [4] - Royal Sentinels in Anor Londo. Rare drop. [5] - The giant that opens the gate to Sen's Fortress. [6] - The Firebomb Giant on top of Sen's Fortress. [7] - Anor Londo: Area in front of Giant Blacksmith. [8] - New Londo Ruins: Behind an illusory wall in a chest and another past the second Hoard, also in a chest. [9] - Drops from Vagrants, specifically the Red Good Vagrant. (Depths, Undead Burg, Undead Parish, Painted World of Ariamis, Darkroot Garden, Darkroot Basin, The Catacombs, Tomb of Giants, The Great Hollow, Ash Lake, Demon Ruins, Lost Izalith, Sen's Fortress, Blighttown, Anor Londo, New Londo Ruins Lower, New Londo Ruins Upper, The Duke's Archives, Crystal Cave, Northern Undead Asylum, Kiln of the First Flame and Royal Wood). [10] - Video Location Timestamp 3:46. [11] - Video Location Timestamp 28:25. [12] - Video Location Timestamp 27:26. [13] - Video Location Timestamp 17:20. [14] - Video Location Timestamp 17:58. [15] - Video Location Timestamp 2:36. [16] - Video Location Timestamp 8:54. [17] - Video Location Timestamp 8:33.",ok_loc_list
Titanite Shard,ITEMS,Ore,https://darksouls.wiki.fextralife.com/Titanite+Shard,/Titanite+Shard,Titanite shard for weapon reinforcement. Most common titanite material. Reinforces standard weapons to +5.Titanite shards are fragments of the Legendary Slabs. Titanite is etched into weapons to reinforce.,ok_blockquote,"[1] - Sold by Blacksmith Andre (800 souls). [2] - Sold by Blacksmith Vamos (800 souls). [3] - Sold by Giant Blacksmith (800 souls). [4] - Sold by Crestfallen Merchant (1,000 souls). [5] - Sold by Hawkeye Gough (800 souls). [6] - Drops from Balder Knights (8% chance for 1 in Undead Parish, 21.6% chance for 1, and 1.8% chance for 2 in Sen's Fortress). [7] - Drops from Undead Soldier (1.6% chance for 1 in Undead Burg, Undead Parish, Northern Undead Asylum (Revisit), and Firelink Shrine). [8] - Drops from Undead Soldier (0.4% chance for 1 in Northern Undead Asylum). [9] - One drops from the non-respawning Berenike Knight in Undead Parish.",ok_loc_list
Titanite Slab,ITEMS,Ore,https://darksouls.wiki.fextralife.com/Titanite+Slab,/Titanite+Slab,"Titanite slab for weapon reinforcement. Legendary Slabs were the domain of the Gods. Reinforces standard weapons to +15, and crystal or lightning weapons to +5. Legendary Slabs are the heirlooms of a nameless blacksmith deity, who forged the weapons of other Gods. Weapons forged with this slab become rare legendary weapons",ok_blockquote,"[1] - Drop: Stray Demon (Northern Undead Asylum) on return. [2] - Rare drop: Darkwraiths (New Londo Ruins), Crystal Lizard (The Great Hollow). [3] - Siegmeyer quest line reward. [4] - Royal Woods (AotA only), in a chest behind waterfall in Kalameet's area.",ok_loc_list
Twinkling Titanite,ITEMS,Ore,https://darksouls.wiki.fextralife.com/Twinkling+Titanite,/Twinkling+Titanite,"This weapon-reinforcing titanite is imbued with a particularly powerful energy.Reinforces weapons that cannot be reinforced normally to +5.After this titanite was peeled from its Slab, it is said that it received a special power, but its specific nature is not clear.",ok_blockquote,"[1] - Merchant: Giant Blacksmith (8,000 souls). [2] - Trade with Snuggly: 1x for Purple Moss Clump, 1x for Bloodred Moss Clump, 2x for Blooming Purple Moss Clump. [3] - Drops from Stone Gaurdians in Oolacile. (AotA only). [4] - Drops from Man-Eater Shell (30% Chance in Ash Lake, 20% chance in Crystal Cave). [5] - Drops from Crystal Lizard (guaranteed - Undead Burg, The Catacombs, Tomb of Giants, The Great Hollow, Darkroot Garden, Lost Izalith, Crystal Cave, The Duke's Archives, Royal Wood, Oolacile Township and Chasm of the Abyss). [6] - Drops from Vagrants, specifically the Red Good Vagrant. (Depths, Undead Burg, Undead Parish, Painted World of Ariamis, Darkroot Garden, Darkroot Basin, The Catacombs, Tomb of Giants, The Great Hollow, Ash Lake, Demon Ruins, Lost Izalith, Sen's Fortress, Blighttown, Anor Londo, New Londo Ruins Lower, New Londo Ruins Upper, The Duke's Archives, Crystal Cave, Northern Undead Asylum, Kiln of the First Flame, and Royal Wood). [7] - Video Location Timestamp 1:14. [8] - Video Location Timestamp 3:24. [9] - Video Location Timestamp 3:55. [10] - Video Location Timestamp 8:45. [11] - Video Location Timestamp 12:00. [12] - Video Location Timestamp 8:33. [13] - Video Location Timestamp 0:22.",ok_loc_list
White Titanite Chunk,ITEMS,Ore,https://darksouls.wiki.fextralife.com/White+Titanite+Chunk,/White+Titanite+Chunk,"Titanite chunk for weapon reinforcement.White titanite has powerful magic energy.Reinforces divine weapons to +9,and occult weapons to +4.With the discovery of chunks in Lordran,the race to locate the Legendary Slabshas begun. But could they be mere myth?",ok_blockquote,[1] - Tomb of Giants. [2] - Trade a Sunlight Medal with Snuggly. [3] - Video Location Timestamp 12:45. [4] - Video Location Timestamp 19:21. [5] - Video Location Timestamp 25:48. [6] - Video Location Timestamp 4:40. [7] - Video Location Timestamp 6:45. [8] - Video Location Timestamp 4:45.,ok_loc_list
White Titanite Slab,ITEMS,Ore,https://darksouls.wiki.fextralife.com/White+Titanite+Slab,/White+Titanite+Slab,"White titanite slab for weapon reinforcement. Legendary Slabs were the domain of the Gods.Reinforces divine weapons to +10, and occult weapons to +5. Legendary Slabs are the heirlooms of a nameless blacksmith deity, who forged the weapons of other Gods. Weapons forged with this slab become rare legendary weapons.",ok_blockquote,"[1] - Found in the Tomb of Giants within a narrow cavern before the Nito fog gate. Video Location Timestamp 26:05. [2] - Found in the Chasm of the Abyss near the Manus, Father of the Abyss fog gate. [3] - Rare drop from the Pinwheel Servant at the fog gate near Gravelord Nito (0.2% Chance - Tomb of Giants. ).",ok_loc_list
Alluring Skull,ITEMS,Projectiles,https://darksouls.wiki.fextralife.com/Alluring+Skull,/Alluring+Skull,"A skull with meekly lingering souls. Throw to shatter and spread souls to attract certain types of enemiesSouls are a concentration of life, and the life-starved Hollows are lured by its power. Not effective for all enemies.",ok_blockquote,[1] - Sold by Undead Merchant (Female) for 500 souls. [2] - Treasure above Armored Boar. [3] - Video Location Timestamp 1:56.,ok_loc_list
Black Firebomb,ITEMS,Projectiles,https://darksouls.wiki.fextralife.com/Black+Firebomb,/Black+Firebomb,"Black bisque urn filled with black powder. Explodes, inflicting fire damage.Powerful ranged weapon, especially in situations called for fire damage. A very precious item at low levels.Black Firebombs are especially destructive.",ok_blockquote,"[1] - Receive 10 as an optional Gift upon character creation. [2] - Sold by Crestfallen Merchant for 500 souls. [3] - Sold by Marvelous Chester for 800 souls. [4] - Treasure x5: Chest at the back of the first open residence, after the bonfire, in Undead Burg. [5] - Video Location Timestamp 5:40. [6] - These bombs (if conserved) can be very useful in Capra Demon's fight. They can be thrown at the demon from atop the staircase while he is slowly walking to the bottom of the stairs, dishing out a considerable chunk of his health before engaging in melee with him. Limited number of Black Firebombs can be compensated with normal Firebombs, making it possible to kill the Capra Demon without having to melee him at all.",ok_loc_list
Dung Pie,ITEMS,Projectiles,https://darksouls.wiki.fextralife.com/Dung+Pie,/Dung+Pie,"Atrocious fecal waste material. Throw at enemy to build up toxins, but also builds up your toxicity.Although the stench makes it difficult to carry on one's person, turning an enemy toxic inflicts high damage over a period of time",ok_blockquote,"[1] - Sold by Female Undead Merchant for 200 souls. [2] - Sold by Hawkeye Gough for 200 souls. [3] - Dropped by Dung Giants (all) in Blighttown. [4] - Drops from Infested Barbarian (50% Chance - Blighttown). [5] - Drops from Vagrants, specifically the White Good Vagrant. (Depths, Undead Burg, Undead Parish, Painted World of Ariamis, Darkroot Garden, Darkroot Basin, The Catacombs, Tomb of Giants, The Great Hollow, Ash Lake, Demon Ruins, Lost Izalith, Sen's Fortress, Blighttown, Anor Londo, New Londo Ruins Lower, New Londo Ruins Upper, The Duke's Archives, Crystal Cave, Northern Undead Asylum, Kiln of the First Flame and Royal Wood).",ok_loc_list
