item_name,group,subcategory,url,path,description,scrape_status,location,loc_status
Black Iron Greatshield,SHIELDS,Greatshields,https://darksouls.wiki.fextralife.com/Black+Iron+Greatshield,/Black+Iron+Greatshield,"""Greatshield of the mighty knight Tarkus"" ""Built of special black iron and even heavier than Knight Berenike's tower shield. Especially resistant to fire attacks and effective for shield bashing.""",ok_blockquote,"[1] - Found on Iron Knight Tarkus' corpse in the grand painting hall of Anor Londo along with his matching armor set. He's on the ground floor, huddled in a corner to the left of the painting.",ok_loc_list
Bonewheel Shield,SHIELDS,Greatshields,https://darksouls.wiki.fextralife.com/Bonewheel+Shield,/Bonewheel+Shield,"""Giant wooden wheel encircled by spikes. Half-melded to a strange skeleton"" ""Can be used as a great shield, only for the great gaps. But at least the spikes turn into weapons with a good spin. Strange indeed!""",ok_blockquote,[1] - Drops from Wheel Skeletons (2% chance - The Catacombs and Painted World of Ariamis). [2] - Video Location Timestamp 25:12.,ok_loc_list
Cleansing Greatshield,SHIELDS,Greatshields,https://darksouls.wiki.fextralife.com/Cleansing+Greatshield,/Cleansing+Greatshield,"The steel greatshield used by Knight Artorias, who succumbed to the Abyss. Artorias, deeply scarred by the Abyss, used this to form a barrier to protect his compatriot Sif. Although this drained the shield, its magic defense remains high.",ok_blockquote,[1] - Rescue Sif from the Chasm of the Abyss. [2] - Video Location Timestamp 2:00.,ok_loc_list
Eagle Shield,SHIELDS,Greatshields,https://darksouls.wiki.fextralife.com/Eagle+Shield,/Eagle+Shield,"""Greatshield with an eagle design. Lightest and easiest greatshield to handle."" ""Greatshields are very stable, and deflect attacks. But one cannot parry, and instead bashes with the shield.""",ok_blockquote,"[1] - Blighttown treasure, found on a rafter close to the upper area Bonfire. [2] - Video Location Timestamp 6:35.",ok_loc_list
Giant Shield,SHIELDS,Greatshields,https://darksouls.wiki.fextralife.com/Giant+Shield,/Giant+Shield,"Greatshield made of bronze and marcasite. Used by the giant sentinels of Anor Londo. Marcasite, or white iron, is effective against non-physical damage, but as the shield is designed for the giant sentineles, its weight is unbearable.""",ok_blockquote,"[1] - Buy from the Giant Blacksmith for 10,000 souls. [2] - Drops from Sentinel (1% chance - Anor Londo). [3] - Drops from Royal Sentinel (1% chance - Anor Londo).",ok_loc_list
Greatshield of Artorias,SHIELDS,Greatshields,https://darksouls.wiki.fextralife.com/Greatshield+of+Artorias,/Greatshield+of+Artorias,"Shield born from the soul of the great grey wolf Sif, guardian of the grave of the Abysswalker Knight Artorias. Boasts consistent defense and divine protection against various status effects.",ok_blockquote,[1] - Ascend a +10 shield with the Soul of Sif.,ok_loc_list
Havel's Greatshield,SHIELDS,Greatshields,https://darksouls.wiki.fextralife.com/Havel%27s+Greatshield,/Havel%27s+Greatshield,"""Greatshield of the legendary Havel the Rock. Cut straight from a great slab of stone."" ""This greatshield is imbued with the magic of Havel, proves a strong defense, and is incredibly heavy. A true divine heirloom on par with the Dragon tooth.""",ok_blockquote,[1] - One of the chests behind the illusionary wall in Anor Londo.,ok_loc_list
Stone Greatshield,SHIELDS,Greatshields,https://darksouls.wiki.fextralife.com/Stone+Greatshield,/Stone+Greatshield,"Mossy round greatshield used by the guardian of the Darkroot garden, the Stone Knight."" ""The Stone Knight is a creation of ancient magic, and this shield is imbued with the same power, but is also extremely heavy.""",ok_blockquote,[1] - Drops from the Great Stone Knight (2% chance - Darkroot Garden).,ok_loc_list
Tower Shield,SHIELDS,Greatshields,https://darksouls.wiki.fextralife.com/Tower+Shield,/Tower+Shield,"""Metal Greatshield. Used by the Knight Berenike, known for his heavy armour. This plate of iron is heavily defensive but ultra heavy. Greatshields are very stable, and deflect attacks. However, one cannot parry, and instead bashes with the shield.""",ok_p_tag,"[1] - Drop: Tower Knights in Undead Parish, Sen's Fortress and the Painted World (respawns). [2] - Purchase: Crestfallen Merchant for 8000 souls.",ok_loc_list
Buckler,SHIELDS,Small Shields,https://darksouls.wiki.fextralife.com/Buckler,/Buckler,"""Very small round metal shield. Parry attacks with large center protrusion. Small shields are always less stable, but landing critical hits after parry is easier. This shield is specialized for parrying.""",ok_blockquote,[1] - Purchase from the Undead Merchant for 800 souls. [2] - Drops from Balder Knight with Rapier (1% chance - Sen's Fortress and Undead Parish).,ok_loc_list
Caduceus Round Shield,SHIELDS,Small Shields,https://darksouls.wiki.fextralife.com/Caduceus+Round+Shield,/Caduceus+Round+Shield,"Round wooden shield crafted in Lordran. Decorated by an ancient blue Caduceus. The giant trees in Lordran are distant offspring of the great stone archtrees. This shield inherits their properites, and the wood greatly reduces magic damage.""",ok_blockquote,[1] - On a corpse in the graveyard next to Firelink Shrine. [2] - Video Location Timestamp 1:46.,ok_loc_list
Cracked Round Shield,SHIELDS,Small Shields,https://darksouls.wiki.fextralife.com/Cracked+Round+Shield,/Cracked+Round+Shield,"Round wooden shield. Cracked and nearly broken. Wood shields are lighter than metal shields, but this one has lower physical damage reduction stability, partly due to cracking.""",ok_blockquote,"[1] - Initial equipment for Pyromancer. [2] - Dropped by Hollow Warriors (with shield) in the Firelink Shrine, Undead Burg, and Undead Parish.",ok_loc_list
Crystal Ring Shield,SHIELDS,Small Shields,https://darksouls.wiki.fextralife.com/Crystal+Ring+Shield,/Crystal+Ring+Shield,"Weapon born from the mystical creature of the Darkroot Garden, the Moonlight Butterfly. Imbued with a powerful crystal power, like the butterfly created by Seath the Scaleless. Can emit crystal light rings",ok_blockquote,[1] - Ascend: From the Soul of the Moonlight Butterfly and a +10 shield by the Giant Blacksmith.,ok_loc_list
Effigy Shield,SHIELDS,Small Shields,https://darksouls.wiki.fextralife.com/Effigy+Shield,/Effigy+Shield,"""Frightful occult shield. Defends against divine weapons and lightning. In an ill-fated plot to destroy the very gods, the followers of the occult once attempted to steal the power of Gravelord Nito, the first of the dead.""",ok_blockquote,"[1] - Found in Tomb of Giants, on a path close to the second bonfire. [2] - Video Location Timestamp 17:12.",ok_loc_list
Leather Shield,SHIELDS,Small Shields,https://darksouls.wiki.fextralife.com/Leather+Shield,/Leather+Shield,"""Round leather-covered shield. A standard, widely-used shield. Small shields are always less stable, but landing critical hits after parry is easier.""",ok_blockquote,[1] - Purchase from the Undead Merchant for 800 Souls. [2] - Initial equipment for Wanderer.,ok_loc_list
Plank Shield,SHIELDS,Small Shields,https://darksouls.wiki.fextralife.com/Plank+Shield,/Plank+Shield,"""Makeshift shield built from wood planks. Provides minimal protection, but at a cost of moderate humiliation.""",ok_blockquote,"[1] - Found on a corpse in Blighttown, just before the hidden entrance to The Great Hollow. [2] - Starter Item: Initial Equipment for Deprived. [3] - Video Location Timestamp 0:05.",ok_loc_list
Red & White Round Shield,SHIELDS,Small Shields,https://darksouls.wiki.fextralife.com/Red+%26+White+Round+Shield,/Red+%26+White+Round+Shield,"""Round wooden shield crafted in Lordran featuring an impressive red and white design. The giant trees in Lordran are distant offspring of the great stone archtrees. This shield inherits their properties, and the wood greatly reduces magic damage.""",ok_blockquote,[1] - Drops from skeleton with shield (2% chance - Firelink Shrine Graveyard and The Catacombs).,ok_loc_list
Small Leather Shield,SHIELDS,Small Shields,https://darksouls.wiki.fextralife.com/Small+Leather+Shield,/Small+Leather+Shield,"Small, leather-covered round shield, reinforced in critical spots with metal.Small shields are always less stable, but landing critical hits after parry is easier.""",ok_blockquote,[1] - Purchase from the Undead Merchant for 600 Souls. [2] - Initial equipment for Sorcerer. [3] - Video Location Timestamp 1:02.,ok_loc_list
Target Shield,SHIELDS,Small Shields,https://darksouls.wiki.fextralife.com/Target+Shield,/Target+Shield,"Small round metal shield. Four protrusions used to parry attacks. Small shields are always less stable, but landing critical hits after parry is easier. This shield is specialized for parrying.",ok_blockquote,[1] - Found on a body inside a small room in Lower Undead Burg just before the Capra Demon. [2] - Initial Equipment for Thief. [3] - Drops from Undead Assassin also known as Hollow Thief (1% chance - Lower Undead Burg). [4] - Video Location: Found in this video at 3:04.,ok_loc_list
Warrior's Round Shield,SHIELDS,Small Shields,https://darksouls.wiki.fextralife.com/Warrior%27s+Round+Shield,/Warrior%27s+Round+Shield,"""Round wooden shield crafted in Lordran. Decorated with the ancient Labrys axe. The giant trees in Lordran are distant offspring of the great stone archtrees. This shield inherits their properties, and the wood reduces magic damage.""",ok_blockquote,[1] - Purchase from the Undead Merchant for 800 souls.,ok_loc_list
Balder Shield,SHIELDS,Standard Shields,https://darksouls.wiki.fextralife.com/Balder+Shield,/Balder+Shield,"""Shield of the knights of the ancient kingdom of Balder. Tweaked for improved stability. Balder was the home of Knight King Rendal, but the kingdom was reduced to ruins after a widespread outbreak of Undead""",ok_blockquote,[1] - Rare drop (1% chance) from Balder Knights who wield it in Undead Parish and Sen's Fortress (they also wield the Balder Side Sword). [2] - Purchase: Crestfallen Merchant for 4000 souls.,ok_loc_list
Black Knight Shield,SHIELDS,Standard Shields,https://darksouls.wiki.fextralife.com/Black+Knight+Shield,/Black+Knight+Shield,"Shield of the Black Knights that wander Lordran. A flowing canal is chiseled deeply into its face. Long ago, the black knights faced the chaos demons, and were charred black, but their shields became highly resistant to fire.",ok_blockquote,"[1] - Drops from The Black Knight. (5% chance - Undead Burg, Undead Parish, Darkroot Basin, The Catacombs, Northern Undead Asylum, Tomb of Giants and Kiln of the First Flame).",ok_loc_list
Bloodshield,SHIELDS,Standard Shields,https://darksouls.wiki.fextralife.com/Bloodshield,/Bloodshield,"""The bloodshield spoken of in the lost legends. The red blood is slightly enchanted, and boost various resistances.""",ok_blockquote,[1] - Location: In the Painted World of Ariamis on the bridge near the Undead Dragon. [2] - Video Location Timestamp 5:53.,ok_loc_list
Caduceus Kite Shield,SHIELDS,Standard Shields,https://darksouls.wiki.fextralife.com/Caduceus+Kite+Shield,/Caduceus+Kite+Shield,"""Medium metal shield. Decorated by an ancient blue Caduceus. A standard, widely-used shield.""",ok_blockquote,[1] - Purchase: Andre of Astora for 1000 souls. [2] - Drops from Swordsman Undead Crystal Soldier (2% chance - The Duke's Archives).,ok_loc_list
Crest Shield,SHIELDS,Standard Shields,https://darksouls.wiki.fextralife.com/Crest+Shield,/Crest+Shield,"Shield of a nameless knight, likely a high-ranking knight of Astora."" ""One of the enchanted blue shields. The Crest Shield greatly reduces magic damage.""",ok_blockquote,[1] - Drops from Oscar of Astora. (Guaranteed - Northern Undead Asylum Revisit).,ok_loc_list
Crystal Shield,SHIELDS,Standard Shields,https://darksouls.wiki.fextralife.com/Crystal+Shield,/Crystal+Shield,"""A fully crystallized straight shield. How such a weapon was created is entirely unknown."" ""The crystallization boosts its defense, but makes the shield brittle. The shield cannot be used for long, as it cannot be repaired.""",ok_blockquote,[1] - Purchase: Domhnall of Zena for 4000 souls.,ok_loc_list
Dragon Crest Shield,SHIELDS,Standard Shields,https://darksouls.wiki.fextralife.com/Dragon+Crest+Shield,/Dragon+Crest+Shield,"Shield of a nameless knight, likely a high-ranked knight of Astora. One of the enchanted blue shields. The dragon crest shield greatly reduces fire damage.",ok_blockquote,"[1] - Valley of Drakes, right under the nose of a dozing Zombie Dragon (the middle of the three items it guards). [2] - Video Location Timestamp 1:16.",ok_loc_list
East-West Shield,SHIELDS,Standard Shields,https://darksouls.wiki.fextralife.com/East-West+Shield,/East-West+Shield,"""A wooden kite shaped shield. It is decorated with the ancient symbol of a double-headed eagle, painted yellow."" ""Wooden shields are lighter than metal shields, but with lower physical damage reduction, and reduced shield stability.""",ok_blockquote,[1] - Starter Item: Initial equipment for Cleric. [2] - Purchase: Undead Merchant (male) in Undead Burg for 400 souls.,ok_loc_list
Gargoyle's Shield,SHIELDS,Standard Shields,https://darksouls.wiki.fextralife.com/Gargoyle%27s+Shield,/Gargoyle%27s+Shield,"""Bronze shield of the gargoyle guarding the Bell of Awakening in the Undead Church."" ""The gargoyle's skin is tough by itself, and perhaps its shield may have been a prop, for it is a rare example of a metal shield that does not reduce physical damage 100%.""",ok_blockquote,[1] - Rare drop from any of the three Gargoyles with shields. [2] - Video Location Timestamp 9:24.,ok_loc_list
Grass Crest Shield,SHIELDS,Standard Shields,https://darksouls.wiki.fextralife.com/Grass+Crest+Shield,/Grass+Crest+Shield,"""Old medium metal shield of unknown origin. The grass crest is lightly imbued with magic, which slightly speeds stamina recovery.""",ok_blockquote,"[1] - Darkroot Basin, at the bottom of Darkroot Garden guarded by a Black Knight. [2] - Video Location Timestamp 12:53.",ok_loc_list
Heater Shield,SHIELDS,Standard Shields,https://darksouls.wiki.fextralife.com/Heater+Shield,/Heater+Shield,"""Small metal shield. A standard, widely-used shield."" ""This shield is easy to use, and is one of the smallest shields that offers 100% physical damage reduction.""",ok_blockquote,[1] - Starter Item: Initial Equipment for Warrior. [2] - Purchase: Undead Merchant for 1000 Souls.,ok_loc_list
Hollow Soldier Shield,SHIELDS,Standard Shields,https://darksouls.wiki.fextralife.com/Hollow+Soldier+Shield,/Hollow+Soldier+Shield,"""Metal shield wielded by Hollow soldiers. Heavily rusted but sturdy, providing a strong defense""",ok_blockquote,"[1] - Obtained as a rare drop from Undead Parish soldiers. [2] - Drops from Undead Soldiers wielding a shield (1% Chance - Undead Burg, Undead Parish, Northern Undead Asylum (Revisit), Firelink Shrine).",ok_loc_list
Iron Round Shield,SHIELDS,Standard Shields,https://darksouls.wiki.fextralife.com/Iron+Round+Shield,/Iron+Round+Shield,"""Thick iron shield of Shiva of the East. Heaviest of the standard shields. Deflects enemy attacks. A famous specimen from Shiva's collection, but none who have faced it have lived to tell the tale.""",ok_blockquote,[1] - Drop from Shiva of the East.,ok_loc_list
Knight Shield,SHIELDS,Standard Shields,https://darksouls.wiki.fextralife.com/Knight+Shield,/Knight+Shield,"""This medium metal shield is elegantly carved and painted."" ""Although it is thought to have been used by ancient knights of nobility, its defense and capabilities are similar to other shields.""",ok_blockquote,"[1] - On a corpse in the Undead Parish just past the Fog Gate. Guarded by an Balder Knight. [2] - Video Location Timestamp 4:33. [3] - Video Location Timestamp 4:30. [4] - Crystal Knight Shield can be found in one of the Mimics at the Duke's Archive, at the upper floor of the library.",ok_loc_list
Large Leather Shield,SHIELDS,Standard Shields,https://darksouls.wiki.fextralife.com/Large+Leather+Shield,/Large+Leather+Shield,"""Large, leather-covered round shield. Choice shield for hunters."" ""Wood shields are lighter than metal shields, but with lower physical damage reductions, and reduced shield stability.""",ok_blockquote,[1] - Starter Item: Initial equipment for Hunter. [2] - Purchase: Andre of Astora for 800 souls. [3] - Drops from Phalanx (1% Chance - Painted World of Ariamis).,ok_loc_list
Pierce Shield,SHIELDS,Standard Shields,https://darksouls.wiki.fextralife.com/Pierce+Shield,/Pierce+Shield,"""Shield of certain knights of Catarina, used in attacks with a large protrusion in the center."" ""Can be used as a thrust weapon.""",ok_blockquote,[1] - Gift: Find Siegmeyer of Catarina in the Blighttown swamp near a group of slugs and give him 3 Purple Moss Clumps.,ok_loc_list
Sanctus,SHIELDS,Standard Shields,https://darksouls.wiki.fextralife.com/Sanctus,/Sanctus,"""A legendary weapon of the Way of the White, granted to an Undead paladin long ago"" ""Once blessed with the protection of a white flame, but its power has all but faded, so that it provides only slight HP recovery.""",ok_blockquote,[1] - Defeating Paladin Leeroy in the Tomb of the Giants before killing the area boss.,ok_loc_list
Silver Knight Shield,SHIELDS,Standard Shields,https://darksouls.wiki.fextralife.com/Silver+Knight+Shield,/Silver+Knight+Shield,"""Shield of the Silver Knights of Anor Londo. A flowing canal is carved deep into its face. The Silver Knights stayed behind in Anor Londo to defend the illusory goddess, and their shields are blessed with her divine protection.""",ok_blockquote,[1] - Obtained as a rare drop from Silver Knights in Anor Londo. [2] - Drops from Silver Knight (1% Chance - Anor Londo).,ok_loc_list
Spider Shield,SHIELDS,Standard Shields,https://darksouls.wiki.fextralife.com/Spider+Shield,/Spider+Shield,"""Shield of the savage mountain bandits. Uniquely-shaped with a large black spider etched upon it."" ""Has resistance to poison.""",ok_blockquote,"[1] - Starter Item: Initial Equipment for Bandit. [2] - Locations: In the Valley of Drakes on the bridge to New Londo Ruins Lower on a corpse, and above the Giant Rat in the Depths by dropping down the hole behind the first Butcher. Video Location Timestamp 9:49.",ok_loc_list
Spiked Shield,SHIELDS,Standard Shields,https://darksouls.wiki.fextralife.com/Spiked+Shield,/Spiked+Shield,"""Shield of the infamous Darkwraith Kirk, Knight of Thorns. Covered with spikes."" ""Can be used as a weapon. Sharp spikes cause heavy bleeding.""",ok_blockquote,[1] - Possible drop from any of the three encounters with Knight Kirk.,ok_loc_list
Sunlight Shield,SHIELDS,Standard Shields,https://darksouls.wiki.fextralife.com/Sunlight+Shield,/Sunlight+Shield,"""Shield of Solaire of Astora, Knight of Sunlight. Decorated with a holy symbol, but Solaire illustrated it himself, and it has no divine powers of its own. As it turns out, Solaire's incredible prowess is a product of his own training, and nothing else.""",ok_blockquote,[1] - Drops from Solaire. [2] - Video Location Timestamp 13:35.,ok_loc_list
Tower Kite Shield,SHIELDS,Standard Shields,https://darksouls.wiki.fextralife.com/Tower+Kite+Shield,/Tower+Kite+Shield,"""Medium metal shield. Decorated with a tower, the symbol of protection. A standard, widely-used shield.""",ok_blockquote,[1] - Starter Item: Initial Equipment for Knight. [2] - Purchase: Andre of Astora for 1000 souls.,ok_loc_list
Wooden Shield,SHIELDS,Standard Shields,https://darksouls.wiki.fextralife.com/Wooden+Shield,/Wooden+Shield,"""Vertically elongated wooden shield. Decorated with a white dragon. ""Wood shields are lighter than metal shields, but with lower physical damage reduction, and reduced shield stability.""",ok_blockquote,[1] - On a corpse behind a door just before the first bonfire in the Undead Burg. [2] - Video Location Timestamp 1:50.,ok_loc_list
Battle Axe,WEAPONS,Axes,https://darksouls.wiki.fextralife.com/Battle+Axe,/Battle+Axe,"Standard battle axe. Inflicts regular damage, making it effective in various situations."" ""Powerful attack due to its weight, but one wrong swing leaves the wielder wide open, so timing and proximity to the enemy must be judged carefully.""",ok_blockquote,"[1] - Starting equipment for Bandit. [2] - Sold by Andre of Astora for 1,000 souls. [3] - Rare drop from axe-wielding Hollow Warriors.",ok_loc_list
Butcher Knife,WEAPONS,Axes,https://darksouls.wiki.fextralife.com/Butcher+Knife,/Butcher+Knife,"Giant butcher knife wielded by the Undead man-eating cook lurking in the Depths. More of a tool for subduing and preparing live catches than an actual weapon. Those who have faced this deadly blade have a deeper sense of how helpless prey must feel.""",ok_blockquote,[1] - Black Phantom Maneater Mildred.,ok_loc_list
Crescent Axe,WEAPONS,Axes,https://darksouls.wiki.fextralife.com/Crescent+Axe,/Crescent+Axe,"Well-used old bronze battle axe with a long hilt and a crescent-shaped blade."" ""One of the blessed weapons of the Way of White. The Crescent Axe is bequeathed to cleric warriors who have proven their faith.""",ok_blockquote,"[1] - Sold by Patches the Hyena at Firelink Shrine for 10,000 souls. [2] - Dropped by Patches the Hyena.",ok_loc_list
Gargoyle Tail Axe,WEAPONS,Axes,https://darksouls.wiki.fextralife.com/Gargoyle+Tail+Axe,/Gargoyle+Tail+Axe,"Sliced tail of the gargoyle guarding the Bell of Awakening in the Undead Church or patrolling in Anor Londo. Can be used as a bronze battle axe. Bends dramatically during large attacks, owing to its nature as a tail.""",ok_blockquote,"[1] - Give to Frampt to receive 50 souls. [2] - Special: This axe increases Bleeding, Poison and Toxin resistance x2. (inventory screen = x4, but equipped = x2) causing the illusion that you get poisoned and bled when you equip it. [3] - Its shaft also bends on heavy attacks. [4] - If your attack doesn't connect with anything, there will be a slight lag at the end of the attack, similar to halberd weapons. [5] - Upgrading the weapon does not increase its Bleed, Poison, and Toxin resistance. The reason the player sees the Bleed, Poison, and Toxin meters when upgrading is because you technically are unequipping and re-equipping the weapon each time you upgrade. [6] - Poison and Toxin resistance make this weapon a good choice in Blighttown.",ok_loc_list
Golem Axe,WEAPONS,Axes,https://darksouls.wiki.fextralife.com/Golem+Axe,/Golem+Axe,"An axe born from the soul of the Iron Golem, guardian of Sen's Fortress who repelled countless heroes who sought Anor Londo."" ""Its powerful one-handed attack imitates the Golem's blade of wind, but the heavy iron blade makes it quite unwieldy.""",ok_blockquote,[1] - Ascending an axe weapon+10 with the Core of an Iron Golem At the Giant Blacksmith in Anor Londo.,ok_loc_list
Hand Axe,WEAPONS,Axes,https://darksouls.wiki.fextralife.com/Hand+Axe,/Hand+Axe,"Small hand axe. Appears identical to a lumberjack's tool, but has an ideal weight and strength, and is easy to handle. One wrong swing leaves the wielder wide open, so timing and proximity to the enemy must be judged carefully.""",ok_blockquote,[1] - Undead Merchant (Male) in Undead Burg for 450 souls. [2] - Obtained as starting equipment for pyromancers.,ok_loc_list
Black Bow of Pharis,WEAPONS,Bows,https://darksouls.wiki.fextralife.com/Black+Bow+of+Pharis,/Black+Bow+of+Pharis,"The preferred black bow of the heroic archer Pharis. Has a longer range than standard bows, but is more difficult to use. Without proper abilities, results will be underwhelming.""",ok_blockquote,"[1] - Darkroot Garden. Drops from Pharis, a faded, female hunter, who stands far to the right of the entrance of the area where Alvina sits, along the cliffside.",ok_loc_list
Composite Bow,WEAPONS,Bows,https://darksouls.wiki.fextralife.com/Composite+Bow,/Composite+Bow,"Composite bow emphasizing power. Requires more strength than standard bows. However, its range is shorter, making it unfit for sniping.",ok_blockquote,"[1] - New Londo Ruins, on a ledge above the large gates overlooking Valley of Drakes. [2] - Video Location Timestamp 4:58.",ok_loc_list
Darkmoon Bow,WEAPONS,Bows,https://darksouls.wiki.fextralife.com/Darkmoon+Bow,/Darkmoon+Bow,"Bow born from the soul of the Dark Sun Gwyndolin, Darkmoon deity who watches over the abandoned city of the Gods, Anor Londo. This golden bow is imbued with powerful magic and is most impressive with Moonlight Arrows.""",ok_blockquote,[1] - Upgrade a +10 bow with Dark Sun Gwyndolin's soul.,ok_loc_list
Longbow,WEAPONS,Bows,https://darksouls.wiki.fextralife.com/Longbow,/Longbow,Large bow. Projectile weapon for experienced hunters.,ok_blockquote,"[1] - A ledge in Darkroot Garden, on the path leading down to Darkroot Basin. The corpse it is found on also contains the Hunter armor and some arrows. [2] - Drops from Undead Crystal Archer (2% chance - the Duke's Archives).",ok_loc_list
Short Bow,WEAPONS,Bows,https://darksouls.wiki.fextralife.com/Short+Bow,/Short+Bow,"Small bow. Standard projectile weapon."" Equip arrows to use. Hold bow and press L1 or LB to aim. Aim. for heads of humanoid foes. Press L2/R2 or LT/R/T to change type of arrows.",ok_blockquote,"[1] - Initial equipment for Hunter. [2] - Undead Merchant (male) in Undead Burg sell the weapon for 1000 Souls. [3] - Drops from Hollows (2% chance - Undead Burg, Northern Undead Asylum, Depths, Northern Undead Asylum (upon returning) and Painted World of Ariamis). [4] - Drops from Torch Hollows (2% chance - Northern Undead Asylum, Lower Undead Burg, Depths and Painted World of Ariamis). [5] - Drops from skeleton (2% chance - Firelink Shrine Graveyard and The Catacombs).",ok_loc_list
